{
  "$schema": "https://json-schema.org/draft/2020-12/schema",
  "title": "Agent Task Contract",
  "type": "object",
  "required": [
    "task_id", "owner", "objective", "owned_paths",
    "acceptance_criteria", "allowed_tests", "max_attempts"
  ],
  "properties": {
    "task_id": { "type": "string", "pattern": "^[A-Z]+-[0-9]{3}$" },
    "owner": {
      "type": "string",
      "enum": ["capture-worker", "pose-worker", "comfy-worker", "reviewer"]
    },
    "objective": { "type": "string", "minLength": 20 },
    "owned_paths": { "type": "array", "minItems": 1, "items": { "type": "string" } },
    "read_only_paths": { "type": "array", "items": { "type": "string" } },
    "forbidden_paths": { "type": "array", "items": { "type": "string" } },
    "acceptance_criteria": { "type": "array", "minItems": 1, "items": { "type": "string" } },
    "allowed_tests": { "type": "array", "items": { "type": "string" } },
    "max_attempts": { "type": "integer", "minimum": 1, "maximum": 2 },
    "requires_human_approval": { "type": "boolean", "default": false }
  },
  "additionalProperties": false
}
